{
  "metadata": {
    "schema_version": "1",
    "artifact_id": "estimator-profile:synthetic-reference",
    "revision": "1",
    "spec_version": "0.7.3",
    "content_hash": {
      "scope": "artifact-content",
      "status": "unresolved",
      "reason": "Generic artifact canonical bytes and digest algorithm remain unresolved pre-v0.8."
    },
    "provenance": {
      "source_kind": "synthetic-fixture",
      "source_id": "examples/estimator-profiles/synthetic-reference-v1.json",
      "source_revision": "1",
      "evidence": ["reference/estimator-models.md"]
    },
    "compatibility": {
      "domain": "EstimatorProfile",
      "contract_revision": "1",
      "profile": {
        "profile_id": "compatibility:estimator-profile-v1",
        "profile_revision": "1",
        "domain": "EstimatorProfile",
        "owner": "reference/estimator-models.md",
        "rule_source": "Domain-owned estimator model and output-contract requirements."
      },
      "declarations": {
        "model_contract_revision": "1",
        "synthetic_fixture": true
      }
    }
  },
  "profile_kind": "SyntheticReference",
  "scope": {
    "use": "SyntheticFixtureOnly",
    "values_are_universal_world_constants": false,
    "statement": "All coefficients are deterministic regression data, not default physics, world facts, or deployment recommendations."
  },
  "runtime_profile_requirement": {
    "profile": {
      "artifact_id": "runtime-profile:reference-fixture",
      "revision": "1"
    },
    "compatibility_profile": {
      "profile_id": "compatibility:runtime-profile-v1",
      "profile_revision": "1",
      "domain": "RuntimeProfile",
      "owner": "reference/runtime-time.md",
      "rule_source": "RuntimeProfile domain-owned compatibility contract."
    },
    "physical_time_is_runtime_tick": false
  },
  "models": [
    {
      "model_id": "estimator:synthetic:energy:physical-work",
      "revision": "1",
      "domain": "Energy",
      "category": "physical_work",
      "owner": {
        "definition_source": "Profile",
        "owner_id": "estimator-profile:synthetic-reference",
        "revision": "1",
        "evidence_ids": ["evidence:synthetic-energy-components"]
      },
      "availability": {"status": "Available"},
      "input_contract": {"required_fields": ["fixture.case_id"]},
      "output_contract": {
        "semantic_type": "Energy",
        "dimension": {"kg": 1, "m": 2, "s": -2, "A": 0, "K": 0, "mol": 0, "cd": 0},
        "unit": "J"
      },
      "evaluation_rule": {
        "kind": "SyntheticFixedCoefficient",
        "coefficient_id": "coefficient:physical-work"
      },
      "coefficients": [
        {
          "coefficient_id": "coefficient:physical-work",
          "owner": {
            "definition_source": "Profile",
            "owner_id": "estimator-profile:synthetic-reference",
            "revision": "1",
            "evidence_ids": ["evidence:synthetic-energy-components"]
          },
          "value": {
            "semantic_type": "Energy",
            "dimension": {"kg": 1, "m": 2, "s": -2, "A": 0, "K": 0, "mol": 0, "cd": 0},
            "value": 100,
            "unit": "J"
          },
          "fixture_only": true
        }
      ]
    },
    {
      "model_id": "estimator:synthetic:energy:reaction",
      "revision": "1",
      "domain": "Energy",
      "category": "reaction_or_thermodynamic",
      "owner": {
        "definition_source": "Profile",
        "owner_id": "estimator-profile:synthetic-reference",
        "revision": "1",
        "evidence_ids": ["evidence:synthetic-energy-components"]
      },
      "availability": {"status": "Available"},
      "input_contract": {"required_fields": ["fixture.case_id"]},
      "output_contract": {
        "semantic_type": "Energy",
        "dimension": {"kg": 1, "m": 2, "s": -2, "A": 0, "K": 0, "mol": 0, "cd": 0},
        "unit": "J"
      },
      "evaluation_rule": {
        "kind": "SyntheticFixedCoefficient",
        "coefficient_id": "coefficient:reaction"
      },
      "coefficients": [
        {
          "coefficient_id": "coefficient:reaction",
          "owner": {
            "definition_source": "Profile",
            "owner_id": "estimator-profile:synthetic-reference",
            "revision": "1",
            "evidence_ids": ["evidence:synthetic-energy-components"]
          },
          "value": {
            "semantic_type": "Energy",
            "dimension": {"kg": 1, "m": 2, "s": -2, "A": 0, "K": 0, "mol": 0, "cd": 0},
            "value": 20,
            "unit": "J"
          },
          "fixture_only": true
        }
      ]
    },
    {
      "model_id": "estimator:synthetic:energy:channel-open",
      "revision": "1",
      "domain": "Energy",
      "category": "channel_open",
      "owner": {
        "definition_source": "Profile",
        "owner_id": "estimator-profile:synthetic-reference",
        "revision": "1",
        "evidence_ids": ["evidence:synthetic-energy-components"]
      },
      "availability": {"status": "Available"},
      "input_contract": {"required_fields": ["fixture.case_id"]},
      "output_contract": {
        "semantic_type": "Energy",
        "dimension": {"kg": 1, "m": 2, "s": -2, "A": 0, "K": 0, "mol": 0, "cd": 0},
        "unit": "J"
      },
      "evaluation_rule": {
        "kind": "SyntheticFixedCoefficient",
        "coefficient_id": "coefficient:channel-open"
      },
      "coefficients": [
        {
          "coefficient_id": "coefficient:channel-open",
          "owner": {
            "definition_source": "Profile",
            "owner_id": "estimator-profile:synthetic-reference",
            "revision": "1",
            "evidence_ids": ["evidence:synthetic-energy-components"]
          },
          "value": {
            "semantic_type": "Energy",
            "dimension": {"kg": 1, "m": 2, "s": -2, "A": 0, "K": 0, "mol": 0, "cd": 0},
            "value": 10,
            "unit": "J"
          },
          "fixture_only": true
        }
      ]
    },
    {
      "model_id": "estimator:synthetic:energy:channel-maintenance",
      "revision": "1",
      "domain": "Energy",
      "category": "channel_maintenance",
      "owner": {
        "definition_source": "Profile",
        "owner_id": "estimator-profile:synthetic-reference",
        "revision": "1",
        "evidence_ids": ["evidence:synthetic-energy-components"]
      },
      "availability": {"status": "Available"},
      "input_contract": {"required_fields": ["fixture.case_id"]},
      "output_contract": {
        "semantic_type": "Energy",
        "dimension": {"kg": 1, "m": 2, "s": -2, "A": 0, "K": 0, "mol": 0, "cd": 0},
        "unit": "J"
      },
      "evaluation_rule": {
        "kind": "SyntheticFixedCoefficient",
        "coefficient_id": "coefficient:channel-maintenance"
      },
      "coefficients": [
        {
          "coefficient_id": "coefficient:channel-maintenance",
          "owner": {
            "definition_source": "Profile",
            "owner_id": "estimator-profile:synthetic-reference",
            "revision": "1",
            "evidence_ids": ["evidence:synthetic-energy-components"]
          },
          "value": {
            "semantic_type": "Energy",
            "dimension": {"kg": 1, "m": 2, "s": -2, "A": 0, "K": 0, "mol": 0, "cd": 0},
            "value": 30,
            "unit": "J"
          },
          "fixture_only": true
        }
      ]
    },
    {
      "model_id": "estimator:synthetic:energy:control",
      "revision": "1",
      "domain": "Energy",
      "category": "control",
      "owner": {
        "definition_source": "Profile",
        "owner_id": "estimator-profile:synthetic-reference",
        "revision": "1",
        "evidence_ids": ["evidence:synthetic-energy-components"]
      },
      "availability": {"status": "Available"},
      "input_contract": {"required_fields": ["fixture.case_id"]},
      "output_contract": {
        "semantic_type": "Energy",
        "dimension": {"kg": 1, "m": 2, "s": -2, "A": 0, "K": 0, "mol": 0, "cd": 0},
        "unit": "J"
      },
      "evaluation_rule": {
        "kind": "SyntheticFixedCoefficient",
        "coefficient_id": "coefficient:control"
      },
      "coefficients": [
        {
          "coefficient_id": "coefficient:control",
          "owner": {
            "definition_source": "Profile",
            "owner_id": "estimator-profile:synthetic-reference",
            "revision": "1",
            "evidence_ids": ["evidence:synthetic-energy-components"]
          },
          "value": {
            "semantic_type": "Energy",
            "dimension": {"kg": 1, "m": 2, "s": -2, "A": 0, "K": 0, "mol": 0, "cd": 0},
            "value": 15,
            "unit": "J"
          },
          "fixture_only": true
        }
      ]
    },
    {
      "model_id": "estimator:synthetic:energy:observation",
      "revision": "1",
      "domain": "Energy",
      "category": "observation_information",
      "owner": {
        "definition_source": "Profile",
        "owner_id": "estimator-profile:synthetic-reference",
        "revision": "1",
        "evidence_ids": ["evidence:synthetic-energy-components"]
      },
      "availability": {"status": "Available"},
      "input_contract": {"required_fields": ["fixture.case_id"]},
      "output_contract": {
        "semantic_type": "Energy",
        "dimension": {"kg": 1, "m": 2, "s": -2, "A": 0, "K": 0, "mol": 0, "cd": 0},
        "unit": "J"
      },
      "evaluation_rule": {
        "kind": "SyntheticFixedCoefficient",
        "coefficient_id": "coefficient:observation"
      },
      "coefficients": [
        {
          "coefficient_id": "coefficient:observation",
          "owner": {
            "definition_source": "Profile",
            "owner_id": "estimator-profile:synthetic-reference",
            "revision": "1",
            "evidence_ids": ["evidence:synthetic-energy-components"]
          },
          "value": {
            "semantic_type": "Energy",